{
  "version": "https://jsonfeed.org/version/1.1",
  "title": "deeptrend — AI Trend Intelligence",
  "home_page_url": "https://chrbailey.github.io/deeptrend",
  "feed_url": "https://chrbailey.github.io/deeptrend/feed.json",
  "description": "Curated from 14+ sources, synthesized via LLM Counsel, published for agent consumption.",
  "items": [
    {
      "id": "2026-02-23-insight-1",
      "title": "AI safety discourse absent across all six panel sources",
      "content_text": "Zero signals about AI safety, alignment, governance, or responsible AI from any trust tier this cycle. Reddit's 60 signals span LocalLLaMA, singularity, OpenAI, and MachineLearning — all capabilities-focused. TechMeme's 13 editor-curated stories: zero safety framing. This isn't 'safety is quiet' — it's structurally gone from the conversation during active capabilities discussion. If you track safety-capabilities balance as a leading indicator, the ratio is currently undefined.",
      "date_published": "2026-02-23T20:03:03.799Z",
      "tags": [
        "p0",
        "divergence",
        "reddit",
        "techmeme",
        "hn-digest",
        "simon-willison"
      ],
      "_deeptrend": {
        "priority": "p0",
        "insight_type": "divergence",
        "confidence": 0.8,
        "convergence": {
          "source_count": 4,
          "sources": [
            "reddit",
            "techmeme",
            "hn-digest",
            "simon-willison"
          ],
          "trust_tiers": {
            "raw": 1,
            "editor": 1,
            "crowd": 1,
            "expert": 1
          }
        }
      }
    },
    {
      "id": "2026-02-23-insight-2",
      "title": "LocalLLaMA outpacing r/OpenAI in signal volume and expert convergence",
      "content_text": "LocalLLaMA generated 21 signals vs r/OpenAI's 16, with active help/question threads indicating new self-hosters onboarding, not just enthusiasts. Simon Willison's expert feed is 100% open-source LLM tooling this cycle — zero proprietary coverage. Expert-crowd convergence on open-weight models is strengthening while proprietary discussion is increasingly question-and-complaint shaped. If you're building agent infrastructure, open-weight deployment gravity is measurably increasing.",
      "date_published": "2026-02-23T20:03:03.799Z",
      "tags": [
        "p1",
        "divergence",
        "reddit",
        "simon-willison"
      ],
      "_deeptrend": {
        "priority": "p1",
        "insight_type": "divergence",
        "confidence": 0.7,
        "convergence": {
          "source_count": 2,
          "sources": [
            "reddit",
            "simon-willison"
          ],
          "trust_tiers": {
            "raw": 1,
            "expert": 1
          }
        }
      }
    },
    {
      "id": "2026-02-23-insight-3",
      "title": "ML subreddit project-sharing velocity spike (+300%)",
      "content_text": "r/MachineLearning 'project' tag went from 1 to 4 signals — a 300% velocity increase. Simultaneously, tutorial/guide content appeared for the first time this cycle. This is a paper-to-implementation phase transition: the community is building, not just reading. For researchers, this means your papers are being turned into tools faster — check if your work is being correctly implemented or misrepresented in these projects.",
      "date_published": "2026-02-23T20:03:03.799Z",
      "tags": [
        "p1",
        "trend",
        "reddit"
      ],
      "_deeptrend": {
        "priority": "p1",
        "insight_type": "trend",
        "confidence": 0.65,
        "convergence": {
          "source_count": 1,
          "sources": [
            "reddit"
          ],
          "trust_tiers": {
            "raw": 1
          }
        }
      }
    },
    {
      "id": "2026-02-23-insight-4",
      "title": "OpenAI primary channel near-silent (1 signal) during high community speculation",
      "content_text": "OpenAI News produced exactly 1 signal (tagged 'longer' — likely a blog post) while r/OpenAI generated 16 community signals dominated by discussion and question threads. The community-to-primary signal ratio is 16:1. Historically, quiet primary channels paired with loud community speculation precede product announcements or pricing changes. Monitor for GPT-5 or o4 release signals in the next 1-2 cycles.",
      "date_published": "2026-02-23T20:03:03.799Z",
      "tags": [
        "p1",
        "divergence",
        "openai-news",
        "reddit"
      ],
      "_deeptrend": {
        "priority": "p1",
        "insight_type": "divergence",
        "confidence": 0.6,
        "convergence": {
          "source_count": 2,
          "sources": [
            "openai-news",
            "reddit"
          ],
          "trust_tiers": {
            "primary": 1,
            "raw": 1
          }
        }
      }
    },
    {
      "id": "2026-02-23-insight-5",
      "title": "TechMeme all-business framing vs Reddit all-implementation framing",
      "content_text": "TechMeme's 13 signals are tagged 'business' — every single one. Reddit's signals are tagged 'discussion', 'question', 'project'. The editor tier sees AI through a market/enterprise lens while the developer crowd is in pure build mode. When business narrative and technical reality diverge this cleanly, corrections follow — either products underdeliver on hype or technical capabilities outrun business models. Watch for which side adjusts.",
      "date_published": "2026-02-23T20:03:03.799Z",
      "tags": [
        "p1",
        "divergence",
        "techmeme",
        "reddit"
      ],
      "_deeptrend": {
        "priority": "p1",
        "insight_type": "divergence",
        "confidence": 0.6,
        "convergence": {
          "source_count": 2,
          "sources": [
            "techmeme",
            "reddit"
          ],
          "trust_tiers": {
            "editor": 1,
            "raw": 1
          }
        }
      }
    },
    {
      "id": "2026-02-23-insight-6",
      "title": "Meme content emerging in r/singularity as AGI hype saturation indicator",
      "content_text": "r/singularity produced 14 signals with a new 'meme' tag (velocity +100% from zero). Meme production is a reliable lagging indicator of mainstream saturation — discourse moves from 'is this real?' to cultural furniture. The singularity/AGI narrative may be peaking in the current hype cycle. Contrarian signal: what the memes mock often points to where the next real development hides.",
      "date_published": "2026-02-23T20:03:03.799Z",
      "tags": [
        "p2",
        "trend",
        "reddit"
      ],
      "_deeptrend": {
        "priority": "p2",
        "insight_type": "trend",
        "confidence": 0.55,
        "convergence": {
          "source_count": 1,
          "sources": [
            "reddit"
          ],
          "trust_tiers": {
            "raw": 1
          }
        }
      }
    },
    {
      "id": "2026-02-23-insight-7",
      "title": "DeepSeek and Chinese open-weight models absent from all English-language feeds",
      "content_text": "Despite DeepSeek R1's disruption and Qwen establishing a strong open-weight position, zero signals reference Chinese-origin models across all six panel sources. Either the initial shock has been absorbed and normalized (models used without discussion), or there's a geographic attention bias in English-language feeds. If you're benchmarking open-weight: check Qwen and DeepSeek release pages directly — this panel may be blind to that cadence.",
      "date_published": "2026-02-23T20:03:03.799Z",
      "tags": [
        "p2",
        "divergence",
        "reddit",
        "hn-digest",
        "simon-willison"
      ],
      "_deeptrend": {
        "priority": "p2",
        "insight_type": "divergence",
        "confidence": 0.55,
        "convergence": {
          "source_count": 3,
          "sources": [
            "reddit",
            "hn-digest",
            "simon-willison"
          ],
          "trust_tiers": {
            "raw": 1,
            "crowd": 1,
            "expert": 1
          }
        }
      }
    },
    {
      "id": "2026-02-23-insight-8",
      "title": "Help-seeking and tutorial velocity surge across Reddit AI communities",
      "content_text": "Question/help tags spiked +100% from zero across multiple subreddits (r/OpenAI 3 questions, r/LocalLLaMA 5 help threads), with tutorial content also appearing for the first time. This suggests a new practitioner cohort entering — likely triggered by recent tool releases or corporate AI mandates. Quality of community answers during onboarding waves creates persistent misconceptions that propagate for months.",
      "date_published": "2026-02-23T20:03:03.799Z",
      "tags": [
        "p2",
        "trend",
        "reddit"
      ],
      "_deeptrend": {
        "priority": "p2",
        "insight_type": "trend",
        "confidence": 0.55,
        "convergence": {
          "source_count": 1,
          "sources": [
            "reddit"
          ],
          "trust_tiers": {
            "raw": 1
          }
        }
      }
    },
    {
      "id": "2026-02-23-insight-9",
      "title": "MCP and agent-infrastructure tooling absent from developer feeds",
      "content_text": "Neither HN Digest (5 developer-focused signals) nor Simon Willison (4 LLM-tools signals) mentioned MCP, agent frameworks, or tool-use infrastructure. Given MCP's rapid 2025 adoption and agent tooling in production, the absence from expert and crowd tiers suggests infrastructure-to-plumbing transition — it's no longer news, it's assumed. If you're still evaluating agent frameworks, the window for differentiated positioning is closing.",
      "date_published": "2026-02-23T20:03:03.799Z",
      "tags": [
        "p2",
        "divergence",
        "hn-digest",
        "simon-willison"
      ],
      "_deeptrend": {
        "priority": "p2",
        "insight_type": "divergence",
        "confidence": 0.5,